{
  "$schema": "https://json-schema.org/draft/2020-12/schema",
  "title": "Property",
  "description": "Data contract for a neighborhood property listing",
  "type": "object",
  "additionalProperties": false,
  "properties": {
    "property_id": {
      "type": "string",
      "minLength": 1
    },
    "address": {
      "type": "string",
      "minLength": 1
    },
    "city": {
      "type": "string",
      "minLength": 1
    },
    "state": {
      "type": "string",
      "pattern": "^[A-Z]{2}$"
    },
    "zip_code": {
      "type": "string",
      "pattern": "^[0-9]{5}$"
    },
    "price": {
      "type": "number",
      "minimum": 0
    },
    "bedrooms": {
      "type": "integer",
      "minimum": 0
    },
    "bathrooms": {
      "type": "number",
      "minimum": 0
    },
    "square_feet": {
      "type": "integer",
      "minimum": 0
    },
    "amenities": {
      "type": "array",
      "items": {
        "type": "string",
        "minLength": 1
      }
    },
    "local_sponsors": {
      "type": "array",
      "items": {
        "type": "object",
        "additionalProperties": false,
        "properties": {
          "sponsor_id": {
            "type": "string",
            "minLength": 1
          },
          "name": {
            "type": "string",
            "minLength": 1
          },
          "category": {
            "type": "string",
            "enum": [
              "realtor",
              "mortgage",
              "insurance",
              "home_services",
              "moving"
            ]
          }
        },
        "required": [
          "sponsor_id",
          "name",
          "category"
        ]
      }
    }
  },
  "required": [
    "property_id",
    "address",
    "city",
    "state",
    "zip_code",
    "price",
    "bedrooms",
    "bathrooms",
    "square_feet",
    "amenities",
    "local_sponsors"
  ]
}